{
  "formatVersion": 1,
  "name": "craft-stories",
  "version": "0.0.2",
  "description": "Code grounding, specification audits and local user-story drafts.",
  "instructions": "AGENTS.md",
  "skills": [
    "skills/audit-specs",
    "skills/ground-spec",
    "skills/write-stories"
  ],
  "workflows": [
    "workflows/prepare-stories.md"
  ],
  "standards": [],
  "evals": [
    "evals/unreachable-source.json"
  ],
  "tools": [],
  "hooks": [
    {
      "name": "observe-session-start",
      "event": "session-start",
      "tool": "any",
      "handler": "observe"
    },
    {
      "name": "observe-before-prompt",
      "event": "before-prompt",
      "tool": "any",
      "handler": "observe"
    },
    {
      "name": "observe-before-tool",
      "event": "before-tool",
      "tool": "any",
      "handler": "observe"
    },
    {
      "name": "observe-after-tool",
      "event": "after-tool",
      "tool": "any",
      "handler": "observe"
    },
    {
      "name": "observe-before-compact",
      "event": "before-compact",
      "tool": "any",
      "handler": "observe"
    },
    {
      "name": "observe-after-compact",
      "event": "after-compact",
      "tool": "any",
      "handler": "observe"
    },
    {
      "name": "observe-turn-end",
      "event": "turn-end",
      "tool": "any",
      "handler": "observe"
    }
  ],
  "mcp": [],
  "optionalDependencies": [],
  "author": {
    "name": "craft-capabilities contributors"
  }
}
